{
  "id": "room_biome2_11",
  "biome": "biome2",
  "size": {
    "width": 12,
    "height": 12
  },
  "layout": {
    "elevation": [
      1,
      1,
      0,
      0,
      0,
      0,
      0,
      2,
      1,
      2,
      1,
      0,
      0,
      1,
      0,
      1,
      2,
      0,
      0,
      1,
      2,
      1,
      0,
      0,
      0,
      0,
      2,
      0,
      2,
      1,
      1,
      0,
      1,
      2,
      0,
      1,
      0,
      0,
      0,
      2,
      0,
      0,
      0,
      1,
      0,
      0,
      0,
      0,
      0,
      2,
      0,
      1,
      0,
      0,
      1,
      0,
      0,
      0,
      0,
      2,
      1,
      0,
      0,
      0,
      0,
      1,
      0,
      0,
      2,
      0,
      0,
      0,
      2,
      0,
      1,
      2,
      0,
      2,
      0,
      0,
      0,
      0,
      0,
      1,
      2,
      0,
      0,
      0,
      0,
      0,
      0,
      0,
      1,
      1,
      0,
      0,
      0,
      0,
      0,
      0,
      2,
      0,
      0,
      2,
      2,
      1,
      0,
      1,
      1,
      2,
      0,
      0,
      1,
      0,
      0,
      0,
      1,
      0,
      1,
      0,
      0,
      1,
      2,
      2,
      2,
      0,
      0,
      0,
      1,
      0,
      0,
      2,
      1,
      0,
      0,
      0,
      0,
      1,
      0,
      0,
      1,
      0,
      0,
      0
    ],
    "cover": [
      0,
      1,
      0,
      2,
      0,
      1,
      0,
      2,
      2,
      0,
      0,
      0,
      0,
      0,
      1,
      2,
      0,
      2,
      1,
      2,
      1,
      1,
      2,
      0,
      1,
      0,
      1,
      0,
      1,
      2,
      0,
      2,
      0,
      0,
      1,
      1,
      2,
      0,
      0,
      0,
      2,
      0,
      1,
      1,
      0,
      1,
      0,
      2,
      2,
      1,
      0,
      0,
      0,
      0,
      0,
      0,
      2,
      1,
      1,
      0,
      0,
      0,
      0,
      2,
      1,
      2,
      0,
      1,
      0,
      0,
      2,
      1,
      1,
      1,
      0,
      0,
      0,
      0,
      0,
      0,
      0,
      0,
      0,
      0,
      0,
      2,
      2,
      0,
      0,
      2,
      2,
      1,
      0,
      1,
      2,
      2,
      0,
      1,
      2,
      2,
      0,
      0,
      0,
      0,
      1,
      0,
      0,
      0,
      0,
      1,
      1,
      2,
      1,
      2,
      1,
      0,
      0,
      1,
      2,
      2,
      0,
      0,
      0,
      0,
      0,
      2,
      0,
      0,
      1,
      0,
      2,
      2,
      0,
      2,
      0,
      0,
      2,
      1,
      0,
      2,
      0,
      0,
      0,
      0
    ],
    "blocked": [
      false,
      false,
      false,
      true,
      false,
      false,
      false,
      true,
      true,
      false,
      false,
      false,
      false,
      false,
      false,
      true,
      false,
      true,
      false,
      false,
      false,
      false,
      true,
      false,
      false,
      false,
      false,
      false,
      false,
      true,
      false,
      true,
      false,
      false,
      false,
      false,
      true,
      false,
      false,
      false,
      false,
      false,
      false,
      false,
      false,
      false,
      false,
      true,
      false,
      false,
      false,
      false,
      false,
      false,
      false,
      false,
      false,
      false,
      false,
      false,
      false,
      false,
      false,
      true,
      false,
      false,
      false,
      false,
      false,
      false,
      true,
      false,
      false,
      false,
      false,
      false,
      false,
      false,
      false,
      false,
      false,
      false,
      false,
      false,
      false,
      false,
      false,
      false,
      false,
      false,
      false,
      false,
      false,
      false,
      false,
      true,
      false,
      false,
      true,
      false,
      false,
      false,
      false,
      false,
      false,
      false,
      false,
      false,
      false,
      false,
      false,
      true,
      false,
      true,
      false,
      false,
      false,
      false,
      false,
      false,
      false,
      false,
      false,
      false,
      false,
      true,
      false,
      false,
      false,
      false,
      false,
      false,
      false,
      false,
      false,
      false,
      false,
      false,
      false,
      true,
      false,
      false,
      false,
      false
    ],
    "vision_blocked": [
      false,
      false,
      false,
      true,
      false,
      false,
      false,
      true,
      true,
      false,
      false,
      false,
      false,
      false,
      false,
      true,
      false,
      true,
      false,
      false,
      false,
      false,
      true,
      false,
      false,
      false,
      false,
      false,
      false,
      true,
      false,
      true,
      false,
      false,
      false,
      false,
      true,
      false,
      false,
      false,
      false,
      false,
      false,
      false,
      false,
      false,
      false,
      true,
      false,
      false,
      false,
      false,
      false,
      false,
      false,
      false,
      false,
      false,
      false,
      false,
      false,
      false,
      false,
      true,
      false,
      false,
      false,
      false,
      false,
      false,
      true,
      false,
      false,
      false,
      false,
      false,
      false,
      false,
      false,
      false,
      false,
      false,
      false,
      false,
      false,
      false,
      false,
      false,
      false,
      false,
      false,
      false,
      false,
      false,
      false,
      true,
      false,
      false,
      true,
      false,
      false,
      false,
      false,
      false,
      false,
      false,
      false,
      false,
      false,
      false,
      false,
      true,
      false,
      true,
      false,
      false,
      false,
      false,
      false,
      false,
      false,
      false,
      false,
      false,
      false,
      true,
      false,
      false,
      false,
      false,
      false,
      false,
      false,
      false,
      false,
      false,
      false,
      false,
      false,
      true,
      false,
      false,
      false,
      false
    ]
  },
  "encounters": [
    {
      "enemy_type": "tank",
      "count": 2,
      "positions": [
        {
          "x": 9,
          "y": 3
        },
        {
          "x": 5,
          "y": 3
        }
      ]
    },
    {
      "enemy_type": "mage",
      "count": 1,
      "positions": [
        {
          "x": 5,
          "y": 5
        }
      ]
    },
    {
      "enemy_type": "archer",
      "count": 2,
      "positions": [
        {
          "x": 8,
          "y": 3
        },
        {
          "x": 8,
          "y": 11
        }
      ]
    }
  ],
  "player_start": {
    "x": 1,
    "y": 5
  }
}