{
  "id": "room_biome3_10",
  "biome": "biome3",
  "size": {
    "width": 12,
    "height": 12
  },
  "layout": {
    "elevation": [
      0,
      0,
      0,
      1,
      0,
      0,
      0,
      2,
      2,
      0,
      0,
      1,
      2,
      0,
      0,
      1,
      0,
      0,
      0,
      0,
      2,
      0,
      2,
      0,
      1,
      0,
      0,
      1,
      0,
      0,
      0,
      2,
      1,
      0,
      0,
      2,
      0,
      0,
      2,
      0,
      0,
      0,
      1,
      0,
      0,
      0,
      2,
      0,
      2,
      0,
      1,
      0,
      0,
      0,
      2,
      1,
      0,
      0,
      0,
      0,
      2,
      0,
      0,
      1,
      0,
      1,
      1,
      0,
      0,
      0,
      0,
      0,
      0,
      2,
      0,
      0,
      0,
      0,
      2,
      0,
      2,
      0,
      0,
      0,
      0,
      2,
      1,
      2,
      1,
      0,
      0,
      2,
      1,
      1,
      1,
      2,
      2,
      0,
      0,
      2,
      1,
      0,
      2,
      2,
      1,
      1,
      2,
      0,
      0,
      1,
      1,
      0,
      0,
      1,
      0,
      1,
      2,
      1,
      2,
      1,
      0,
      2,
      1,
      1,
      1,
      2,
      0,
      2,
      0,
      0,
      0,
      1,
      0,
      0,
      0,
      1,
      2,
      0,
      1,
      0,
      1,
      0,
      0,
      1
    ],
    "cover": [
      0,
      0,
      0,
      0,
      2,
      0,
      1,
      0,
      2,
      1,
      0,
      0,
      1,
      0,
      1,
      0,
      0,
      0,
      2,
      1,
      1,
      1,
      0,
      0,
      1,
      2,
      1,
      0,
      0,
      0,
      2,
      0,
      0,
      0,
      1,
      0,
      0,
      0,
      0,
      0,
      2,
      0,
      0,
      2,
      0,
      1,
      2,
      1,
      1,
      2,
      0,
      2,
      1,
      1,
      2,
      2,
      1,
      0,
      0,
      0,
      1,
      2,
      0,
      0,
      1,
      0,
      0,
      0,
      1,
      0,
      2,
      2,
      2,
      1,
      0,
      0,
      2,
      0,
      0,
      2,
      0,
      0,
      2,
      2,
      2,
      0,
      1,
      2,
      0,
      0,
      2,
      0,
      0,
      2,
      0,
      0,
      0,
      0,
      0,
      0,
      0,
      0,
      2,
      0,
      0,
      0,
      2,
      2,
      0,
      1,
      0,
      1,
      0,
      1,
      2,
      1,
      0,
      0,
      0,
      1,
      2,
      0,
      2,
      0,
      0,
      2,
      2,
      2,
      2,
      0,
      1,
      0,
      1,
      2,
      1,
      2,
      1,
      2,
      0,
      0,
      0,
      0,
      0,
      1
    ],
    "blocked": [
      false,
      false,
      false,
      false,
      true,
      false,
      false,
      false,
      true,
      false,
      false,
      false,
      false,
      false,
      false,
      false,
      false,
      false,
      true,
      false,
      false,
      false,
      false,
      false,
      false,
      false,
      false,
      false,
      false,
      false,
      true,
      false,
      false,
      false,
      false,
      false,
      false,
      false,
      false,
      false,
      false,
      false,
      false,
      false,
      false,
      false,
      true,
      false,
      false,
      false,
      false,
      false,
      false,
      false,
      true,
      true,
      false,
      false,
      false,
      false,
      false,
      true,
      false,
      false,
      false,
      false,
      false,
      false,
      false,
      false,
      false,
      false,
      true,
      false,
      false,
      false,
      false,
      false,
      false,
      true,
      false,
      false,
      true,
      true,
      false,
      false,
      false,
      true,
      false,
      false,
      true,
      false,
      false,
      true,
      false,
      false,
      false,
      false,
      false,
      false,
      false,
      false,
      true,
      false,
      false,
      false,
      true,
      false,
      false,
      false,
      false,
      false,
      false,
      false,
      false,
      false,
      false,
      false,
      false,
      false,
      true,
      false,
      true,
      false,
      false,
      false,
      true,
      true,
      true,
      false,
      false,
      false,
      false,
      true,
      false,
      true,
      false,
      true,
      false,
      false,
      false,
      false,
      false,
      false
    ],
    "vision_blocked": [
      false,
      false,
      false,
      false,
      true,
      false,
      false,
      false,
      true,
      false,
      false,
      false,
      false,
      false,
      false,
      false,
      false,
      false,
      true,
      false,
      false,
      false,
      false,
      false,
      false,
      false,
      false,
      false,
      false,
      false,
      true,
      false,
      false,
      false,
      false,
      false,
      false,
      false,
      false,
      false,
      false,
      false,
      false,
      false,
      false,
      false,
      true,
      false,
      false,
      false,
      false,
      false,
      false,
      false,
      true,
      true,
      false,
      false,
      false,
      false,
      false,
      true,
      false,
      false,
      false,
      false,
      false,
      false,
      false,
      false,
      false,
      false,
      true,
      false,
      false,
      false,
      false,
      false,
      false,
      true,
      false,
      false,
      true,
      true,
      false,
      false,
      false,
      true,
      false,
      false,
      true,
      false,
      false,
      true,
      false,
      false,
      false,
      false,
      false,
      false,
      false,
      false,
      true,
      false,
      false,
      false,
      true,
      false,
      false,
      false,
      false,
      false,
      false,
      false,
      false,
      false,
      false,
      false,
      false,
      false,
      true,
      false,
      true,
      false,
      false,
      false,
      true,
      true,
      true,
      false,
      false,
      false,
      false,
      true,
      false,
      true,
      false,
      true,
      false,
      false,
      false,
      false,
      false,
      false
    ]
  },
  "encounters": [
    {
      "enemy_type": "archer",
      "count": 3,
      "positions": [
        {
          "x": 10,
          "y": 10
        },
        {
          "x": 9,
          "y": 9
        },
        {
          "x": 9,
          "y": 4
        }
      ]
    }
  ],
  "player_start": {
    "x": 1,
    "y": 4
  }
}