{
  "id": "room_biome1_02",
  "biome": "biome1",
  "size": {
    "width": 12,
    "height": 12
  },
  "layout": {
    "elevation": [
      0,
      0,
      2,
      0,
      1,
      0,
      0,
      1,
      0,
      0,
      1,
      1,
      0,
      0,
      0,
      1,
      0,
      0,
      0,
      2,
      2,
      2,
      1,
      2,
      0,
      0,
      1,
      0,
      2,
      2,
      0,
      2,
      0,
      0,
      1,
      0,
      0,
      0,
      0,
      0,
      0,
      0,
      0,
      2,
      0,
      2,
      0,
      0,
      2,
      1,
      0,
      0,
      0,
      0,
      2,
      0,
      2,
      0,
      1,
      0,
      0,
      0,
      0,
      2,
      0,
      2,
      1,
      0,
      0,
      1,
      0,
      2,
      0,
      0,
      0,
      1,
      1,
      0,
      0,
      2,
      0,
      1,
      0,
      0,
      0,
      1,
      0,
      0,
      2,
      1,
      2,
      1,
      2,
      2,
      1,
      0,
      0,
      0,
      0,
      0,
      0,
      0,
      1,
      0,
      0,
      2,
      0,
      1,
      1,
      1,
      2,
      0,
      0,
      0,
      2,
      0,
      0,
      0,
      1,
      0,
      0,
      1,
      2,
      0,
      0,
      0,
      2,
      0,
      0,
      1,
      0,
      0,
      1,
      2,
      0,
      0,
      0,
      1,
      0,
      2,
      1,
      1,
      2,
      0
    ],
    "cover": [
      2,
      0,
      1,
      0,
      2,
      0,
      2,
      2,
      2,
      1,
      2,
      0,
      0,
      2,
      2,
      0,
      1,
      0,
      2,
      1,
      0,
      0,
      2,
      0,
      2,
      2,
      2,
      0,
      1,
      0,
      1,
      0,
      0,
      1,
      1,
      2,
      2,
      1,
      0,
      0,
      2,
      2,
      2,
      0,
      1,
      2,
      0,
      2,
      0,
      1,
      0,
      2,
      2,
      2,
      2,
      1,
      2,
      1,
      1,
      2,
      2,
      1,
      1,
      2,
      2,
      0,
      2,
      0,
      0,
      0,
      0,
      0,
      1,
      2,
      0,
      0,
      0,
      0,
      0,
      0,
      1,
      0,
      0,
      1,
      1,
      0,
      0,
      0,
      0,
      0,
      0,
      2,
      0,
      0,
      0,
      2,
      0,
      0,
      0,
      0,
      0,
      2,
      0,
      0,
      1,
      1,
      0,
      1,
      1,
      0,
      0,
      0,
      0,
      0,
      0,
      0,
      0,
      0,
      1,
      2,
      1,
      0,
      1,
      2,
      0,
      0,
      1,
      1,
      2,
      1,
      1,
      0,
      1,
      1,
      0,
      0,
      2,
      0,
      1,
      0,
      2,
      0,
      2,
      2
    ],
    "blocked": [
      true,
      false,
      false,
      false,
      true,
      false,
      false,
      true,
      false,
      false,
      false,
      false,
      false,
      false,
      true,
      false,
      false,
      false,
      false,
      false,
      false,
      false,
      false,
      false,
      true,
      true,
      true,
      false,
      false,
      false,
      false,
      false,
      false,
      false,
      false,
      true,
      false,
      false,
      false,
      false,
      true,
      true,
      true,
      false,
      false,
      false,
      false,
      false,
      false,
      false,
      false,
      false,
      true,
      true,
      true,
      false,
      false,
      false,
      false,
      false,
      true,
      false,
      false,
      false,
      false,
      false,
      true,
      false,
      false,
      false,
      false,
      false,
      false,
      false,
      false,
      false,
      false,
      false,
      false,
      false,
      false,
      false,
      false,
      false,
      false,
      false,
      false,
      false,
      false,
      false,
      false,
      false,
      false,
      false,
      false,
      false,
      false,
      false,
      false,
      false,
      false,
      true,
      false,
      false,
      false,
      false,
      false,
      false,
      false,
      false,
      false,
      false,
      false,
      false,
      false,
      false,
      false,
      false,
      false,
      true,
      false,
      false,
      false,
      false,
      false,
      false,
      false,
      false,
      true,
      false,
      false,
      false,
      false,
      false,
      false,
      false,
      false,
      false,
      false,
      false,
      false,
      false,
      true,
      true
    ],
    "vision_blocked": [
      true,
      false,
      false,
      false,
      true,
      false,
      false,
      true,
      false,
      false,
      false,
      false,
      false,
      false,
      true,
      false,
      false,
      false,
      false,
      false,
      false,
      false,
      false,
      false,
      true,
      true,
      true,
      false,
      false,
      false,
      false,
      false,
      false,
      false,
      false,
      true,
      false,
      false,
      false,
      false,
      true,
      true,
      true,
      false,
      false,
      false,
      false,
      false,
      false,
      false,
      false,
      false,
      true,
      true,
      true,
      false,
      false,
      false,
      false,
      false,
      true,
      false,
      false,
      false,
      false,
      false,
      true,
      false,
      false,
      false,
      false,
      false,
      false,
      false,
      false,
      false,
      false,
      false,
      false,
      false,
      false,
      false,
      false,
      false,
      false,
      false,
      false,
      false,
      false,
      false,
      false,
      false,
      false,
      false,
      false,
      false,
      false,
      false,
      false,
      false,
      false,
      true,
      false,
      false,
      false,
      false,
      false,
      false,
      false,
      false,
      false,
      false,
      false,
      false,
      false,
      false,
      false,
      false,
      false,
      true,
      false,
      false,
      false,
      false,
      false,
      false,
      false,
      false,
      true,
      false,
      false,
      false,
      false,
      false,
      false,
      false,
      false,
      false,
      false,
      false,
      false,
      false,
      true,
      true
    ]
  },
  "encounters": [
    {
      "enemy_type": "archer",
      "count": 3,
      "positions": [
        {
          "x": 9,
          "y": 5
        },
        {
          "x": 9,
          "y": 1
        },
        {
          "x": 9,
          "y": 11
        }
      ]
    }
  ],
  "player_start": {
    "x": 2,
    "y": 10
  }
}