{
  "id": "room_biome3_06",
  "biome": "biome3",
  "size": {
    "width": 12,
    "height": 12
  },
  "layout": {
    "elevation": [
      1,
      1,
      0,
      2,
      0,
      0,
      0,
      0,
      2,
      1,
      0,
      0,
      0,
      1,
      1,
      2,
      1,
      2,
      0,
      0,
      2,
      2,
      0,
      0,
      0,
      0,
      2,
      0,
      0,
      0,
      0,
      0,
      2,
      0,
      0,
      1,
      0,
      0,
      0,
      2,
      0,
      2,
      0,
      1,
      0,
      0,
      1,
      0,
      1,
      0,
      1,
      1,
      1,
      0,
      0,
      0,
      0,
      0,
      1,
      0,
      1,
      0,
      2,
      1,
      0,
      0,
      1,
      0,
      2,
      1,
      0,
      1,
      1,
      0,
      2,
      0,
      1,
      0,
      0,
      0,
      2,
      0,
      0,
      0,
      0,
      0,
      0,
      2,
      0,
      0,
      2,
      1,
      1,
      2,
      0,
      0,
      0,
      0,
      2,
      0,
      0,
      2,
      0,
      1,
      2,
      0,
      2,
      0,
      1,
      0,
      0,
      1,
      0,
      0,
      0,
      2,
      0,
      0,
      0,
      0,
      2,
      2,
      0,
      0,
      0,
      1,
      0,
      0,
      0,
      0,
      2,
      2,
      2,
      0,
      1,
      0,
      0,
      1,
      1,
      0,
      1,
      1,
      2,
      0
    ],
    "cover": [
      2,
      0,
      0,
      0,
      0,
      0,
      0,
      2,
      2,
      2,
      2,
      0,
      1,
      0,
      2,
      0,
      1,
      0,
      0,
      0,
      2,
      1,
      2,
      0,
      0,
      2,
      2,
      0,
      2,
      1,
      1,
      0,
      2,
      0,
      0,
      1,
      0,
      0,
      0,
      2,
      2,
      2,
      2,
      0,
      2,
      1,
      0,
      2,
      0,
      0,
      2,
      0,
      0,
      2,
      2,
      1,
      1,
      1,
      0,
      2,
      2,
      1,
      0,
      1,
      0,
      2,
      2,
      1,
      0,
      0,
      0,
      0,
      0,
      1,
      2,
      2,
      2,
      2,
      2,
      0,
      0,
      0,
      2,
      0,
      0,
      1,
      2,
      0,
      0,
      0,
      2,
      0,
      0,
      0,
      0,
      0,
      2,
      0,
      2,
      0,
      2,
      1,
      1,
      1,
      0,
      0,
      2,
      1,
      1,
      0,
      1,
      0,
      0,
      2,
      0,
      1,
      0,
      0,
      0,
      0,
      0,
      0,
      2,
      1,
      0,
      2,
      0,
      1,
      0,
      2,
      1,
      0,
      1,
      0,
      0,
      0,
      0,
      2,
      1,
      1,
      2,
      0,
      2,
      0
    ],
    "blocked": [
      false,
      false,
      false,
      false,
      false,
      false,
      false,
      false,
      true,
      true,
      true,
      false,
      false,
      false,
      true,
      false,
      false,
      false,
      false,
      false,
      true,
      false,
      true,
      false,
      false,
      false,
      false,
      false,
      true,
      false,
      false,
      false,
      true,
      false,
      false,
      false,
      false,
      false,
      false,
      true,
      false,
      false,
      false,
      false,
      false,
      false,
      false,
      false,
      false,
      false,
      false,
      false,
      false,
      true,
      true,
      false,
      false,
      false,
      false,
      true,
      true,
      false,
      false,
      false,
      false,
      true,
      true,
      false,
      false,
      false,
      false,
      false,
      false,
      false,
      true,
      true,
      true,
      true,
      true,
      false,
      false,
      false,
      false,
      false,
      false,
      false,
      false,
      false,
      false,
      false,
      true,
      false,
      false,
      false,
      false,
      false,
      true,
      false,
      true,
      false,
      false,
      false,
      false,
      false,
      false,
      false,
      false,
      false,
      false,
      false,
      false,
      false,
      false,
      true,
      false,
      false,
      false,
      false,
      false,
      false,
      false,
      false,
      true,
      false,
      false,
      true,
      false,
      false,
      false,
      true,
      false,
      false,
      false,
      false,
      false,
      false,
      false,
      false,
      false,
      false,
      true,
      false,
      true,
      false
    ],
    "vision_blocked": [
      false,
      false,
      false,
      false,
      false,
      false,
      false,
      false,
      true,
      true,
      true,
      false,
      false,
      false,
      true,
      false,
      false,
      false,
      false,
      false,
      true,
      false,
      true,
      false,
      false,
      false,
      false,
      false,
      true,
      false,
      false,
      false,
      true,
      false,
      false,
      false,
      false,
      false,
      false,
      true,
      false,
      false,
      false,
      false,
      false,
      false,
      false,
      false,
      false,
      false,
      false,
      false,
      false,
      true,
      true,
      false,
      false,
      false,
      false,
      true,
      true,
      false,
      false,
      false,
      false,
      true,
      true,
      false,
      false,
      false,
      false,
      false,
      false,
      false,
      true,
      true,
      true,
      true,
      true,
      false,
      false,
      false,
      false,
      false,
      false,
      false,
      false,
      false,
      false,
      false,
      true,
      false,
      false,
      false,
      false,
      false,
      true,
      false,
      true,
      false,
      false,
      false,
      false,
      false,
      false,
      false,
      false,
      false,
      false,
      false,
      false,
      false,
      false,
      true,
      false,
      false,
      false,
      false,
      false,
      false,
      false,
      false,
      true,
      false,
      false,
      true,
      false,
      false,
      false,
      true,
      false,
      false,
      false,
      false,
      false,
      false,
      false,
      false,
      false,
      false,
      true,
      false,
      true,
      false
    ]
  },
  "encounters": [
    {
      "enemy_type": "mage",
      "count": 1,
      "positions": [
        {
          "x": 9,
          "y": 5
        }
      ]
    },
    {
      "enemy_type": "archer",
      "count": 1,
      "positions": [
        {
          "x": 11,
          "y": 8
        }
      ]
    }
  ],
  "player_start": {
    "x": 2,
    "y": 7
  }
}