{
  "id": "room_biome2_05",
  "biome": "biome2",
  "size": {
    "width": 12,
    "height": 12
  },
  "layout": {
    "elevation": [
      0,
      0,
      0,
      0,
      0,
      1,
      0,
      0,
      0,
      0,
      0,
      0,
      1,
      0,
      0,
      1,
      0,
      0,
      0,
      1,
      0,
      0,
      0,
      1,
      1,
      0,
      1,
      0,
      0,
      0,
      2,
      0,
      0,
      0,
      2,
      0,
      2,
      0,
      0,
      0,
      1,
      0,
      0,
      2,
      2,
      0,
      0,
      2,
      0,
      0,
      1,
      0,
      1,
      0,
      0,
      2,
      0,
      2,
      0,
      0,
      0,
      0,
      2,
      1,
      1,
      0,
      0,
      1,
      1,
      2,
      1,
      0,
      2,
      0,
      2,
      0,
      1,
      0,
      0,
      0,
      0,
      2,
      1,
      0,
      0,
      1,
      0,
      0,
      1,
      0,
      1,
      1,
      2,
      0,
      0,
      0,
      0,
      0,
      0,
      0,
      0,
      2,
      0,
      2,
      0,
      0,
      2,
      0,
      0,
      0,
      0,
      0,
      0,
      0,
      1,
      0,
      1,
      1,
      0,
      1,
      1,
      0,
      0,
      1,
      0,
      2,
      0,
      2,
      0,
      0,
      0,
      2,
      0,
      0,
      2,
      1,
      0,
      2,
      2,
      0,
      1,
      0,
      0,
      0
    ],
    "cover": [
      0,
      2,
      0,
      0,
      0,
      0,
      0,
      0,
      0,
      0,
      1,
      1,
      2,
      0,
      2,
      2,
      2,
      0,
      0,
      2,
      0,
      0,
      0,
      0,
      1,
      0,
      0,
      1,
      1,
      0,
      1,
      1,
      2,
      0,
      0,
      2,
      0,
      2,
      0,
      0,
      0,
      0,
      0,
      1,
      0,
      0,
      0,
      1,
      1,
      2,
      0,
      2,
      2,
      1,
      1,
      1,
      2,
      2,
      0,
      2,
      0,
      1,
      1,
      0,
      1,
      0,
      2,
      1,
      0,
      0,
      0,
      1,
      0,
      0,
      0,
      2,
      1,
      2,
      2,
      1,
      0,
      2,
      1,
      2,
      2,
      1,
      0,
      2,
      1,
      0,
      1,
      2,
      2,
      2,
      0,
      1,
      0,
      0,
      1,
      0,
      1,
      0,
      0,
      0,
      0,
      0,
      1,
      1,
      0,
      2,
      0,
      0,
      1,
      0,
      2,
      2,
      1,
      0,
      0,
      1,
      2,
      0,
      1,
      2,
      0,
      2,
      2,
      1,
      2,
      0,
      1,
      2,
      0,
      0,
      1,
      0,
      1,
      2,
      1,
      1,
      2,
      2,
      0,
      0
    ],
    "blocked": [
      false,
      false,
      false,
      false,
      false,
      false,
      false,
      false,
      false,
      false,
      false,
      false,
      true,
      false,
      false,
      false,
      true,
      false,
      false,
      true,
      false,
      false,
      false,
      false,
      false,
      false,
      false,
      false,
      false,
      false,
      false,
      false,
      false,
      false,
      false,
      true,
      false,
      true,
      false,
      false,
      false,
      false,
      false,
      false,
      false,
      false,
      false,
      false,
      false,
      true,
      false,
      true,
      false,
      false,
      false,
      false,
      true,
      false,
      false,
      true,
      false,
      false,
      false,
      false,
      false,
      false,
      false,
      false,
      false,
      false,
      false,
      false,
      false,
      false,
      false,
      true,
      false,
      true,
      false,
      false,
      false,
      true,
      false,
      false,
      false,
      false,
      false,
      true,
      false,
      false,
      false,
      false,
      false,
      false,
      false,
      false,
      false,
      false,
      false,
      false,
      false,
      false,
      false,
      false,
      false,
      false,
      false,
      false,
      false,
      true,
      false,
      false,
      false,
      false,
      false,
      false,
      false,
      false,
      false,
      false,
      true,
      false,
      false,
      false,
      false,
      true,
      true,
      false,
      true,
      false,
      false,
      true,
      false,
      false,
      false,
      false,
      false,
      false,
      false,
      false,
      false,
      true,
      false,
      false
    ],
    "vision_blocked": [
      false,
      false,
      false,
      false,
      false,
      false,
      false,
      false,
      false,
      false,
      false,
      false,
      true,
      false,
      false,
      false,
      true,
      false,
      false,
      true,
      false,
      false,
      false,
      false,
      false,
      false,
      false,
      false,
      false,
      false,
      false,
      false,
      false,
      false,
      false,
      true,
      false,
      true,
      false,
      false,
      false,
      false,
      false,
      false,
      false,
      false,
      false,
      false,
      false,
      true,
      false,
      true,
      false,
      false,
      false,
      false,
      true,
      false,
      false,
      true,
      false,
      false,
      false,
      false,
      false,
      false,
      false,
      false,
      false,
      false,
      false,
      false,
      false,
      false,
      false,
      true,
      false,
      true,
      false,
      false,
      false,
      true,
      false,
      false,
      false,
      false,
      false,
      true,
      false,
      false,
      false,
      false,
      false,
      false,
      false,
      false,
      false,
      false,
      false,
      false,
      false,
      false,
      false,
      false,
      false,
      false,
      false,
      false,
      false,
      true,
      false,
      false,
      false,
      false,
      false,
      false,
      false,
      false,
      false,
      false,
      true,
      false,
      false,
      false,
      false,
      true,
      true,
      false,
      true,
      false,
      false,
      true,
      false,
      false,
      false,
      false,
      false,
      false,
      false,
      false,
      false,
      true,
      false,
      false
    ]
  },
  "encounters": [
    {
      "enemy_type": "grunt",
      "count": 2,
      "positions": [
        {
          "x": 8,
          "y": 6
        },
        {
          "x": 7,
          "y": 3
        }
      ]
    }
  ],
  "player_start": {
    "x": 2,
    "y": 11
  }
}