{
  "id": "room_biome1_04",
  "biome": "biome1",
  "size": {
    "width": 12,
    "height": 12
  },
  "layout": {
    "elevation": [
      1,
      0,
      0,
      0,
      2,
      0,
      2,
      2,
      0,
      0,
      1,
      0,
      1,
      1,
      2,
      0,
      0,
      2,
      0,
      0,
      0,
      1,
      2,
      0,
      0,
      2,
      1,
      0,
      2,
      0,
      0,
      2,
      0,
      0,
      0,
      0,
      0,
      0,
      2,
      0,
      0,
      0,
      1,
      0,
      2,
      0,
      1,
      0,
      0,
      0,
      1,
      2,
      0,
      0,
      0,
      0,
      1,
      1,
      0,
      0,
      1,
      0,
      0,
      2,
      2,
      0,
      1,
      0,
      0,
      1,
      0,
      0,
      0,
      0,
      2,
      2,
      1,
      1,
      0,
      1,
      2,
      0,
      0,
      0,
      1,
      0,
      0,
      0,
      0,
      0,
      2,
      0,
      0,
      0,
      0,
      1,
      0,
      2,
      0,
      1,
      0,
      0,
      0,
      0,
      0,
      0,
      2,
      1,
      0,
      1,
      2,
      2,
      1,
      1,
      0,
      0,
      0,
      2,
      0,
      2,
      0,
      1,
      0,
      0,
      2,
      0,
      0,
      0,
      2,
      1,
      2,
      2,
      0,
      2,
      2,
      1,
      0,
      2,
      1,
      0,
      2,
      0,
      1,
      0
    ],
    "cover": [
      0,
      2,
      1,
      2,
      1,
      0,
      0,
      2,
      0,
      0,
      2,
      0,
      0,
      1,
      1,
      0,
      2,
      2,
      1,
      2,
      1,
      1,
      1,
      0,
      0,
      2,
      0,
      0,
      0,
      0,
      1,
      1,
      0,
      0,
      2,
      0,
      0,
      2,
      1,
      0,
      1,
      1,
      0,
      1,
      0,
      1,
      2,
      0,
      0,
      0,
      1,
      1,
      0,
      1,
      1,
      1,
      0,
      1,
      0,
      2,
      0,
      1,
      2,
      0,
      0,
      2,
      0,
      1,
      0,
      0,
      1,
      2,
      0,
      2,
      1,
      1,
      2,
      0,
      0,
      0,
      1,
      0,
      0,
      0,
      2,
      0,
      1,
      2,
      2,
      0,
      0,
      0,
      0,
      0,
      0,
      1,
      1,
      0,
      0,
      0,
      2,
      1,
      2,
      0,
      0,
      0,
      0,
      0,
      0,
      1,
      2,
      0,
      1,
      2,
      2,
      1,
      0,
      0,
      0,
      1,
      0,
      2,
      0,
      0,
      0,
      1,
      1,
      2,
      2,
      0,
      0,
      0,
      1,
      2,
      0,
      0,
      0,
      0,
      0,
      2,
      0,
      0,
      0,
      2
    ],
    "blocked": [
      false,
      true,
      false,
      false,
      false,
      false,
      false,
      true,
      false,
      false,
      true,
      false,
      false,
      false,
      false,
      false,
      false,
      false,
      false,
      false,
      false,
      false,
      false,
      false,
      false,
      true,
      false,
      false,
      false,
      false,
      false,
      false,
      false,
      false,
      false,
      false,
      false,
      false,
      false,
      false,
      false,
      false,
      false,
      false,
      false,
      false,
      true,
      false,
      false,
      false,
      false,
      false,
      false,
      false,
      false,
      false,
      false,
      false,
      false,
      false,
      false,
      false,
      true,
      false,
      false,
      true,
      false,
      false,
      false,
      false,
      false,
      true,
      false,
      true,
      false,
      false,
      false,
      false,
      false,
      false,
      false,
      false,
      false,
      false,
      false,
      false,
      false,
      true,
      false,
      false,
      false,
      false,
      false,
      false,
      false,
      false,
      false,
      false,
      false,
      false,
      false,
      false,
      false,
      false,
      false,
      false,
      false,
      false,
      false,
      false,
      true,
      false,
      false,
      false,
      true,
      false,
      false,
      false,
      false,
      false,
      false,
      true,
      false,
      false,
      false,
      false,
      false,
      true,
      false,
      false,
      false,
      false,
      false,
      false,
      false,
      false,
      false,
      false,
      false,
      true,
      false,
      false,
      false,
      true
    ],
    "vision_blocked": [
      false,
      true,
      false,
      false,
      false,
      false,
      false,
      true,
      false,
      false,
      true,
      false,
      false,
      false,
      false,
      false,
      false,
      false,
      false,
      false,
      false,
      false,
      false,
      false,
      false,
      true,
      false,
      false,
      false,
      false,
      false,
      false,
      false,
      false,
      false,
      false,
      false,
      false,
      false,
      false,
      false,
      false,
      false,
      false,
      false,
      false,
      true,
      false,
      false,
      false,
      false,
      false,
      false,
      false,
      false,
      false,
      false,
      false,
      false,
      false,
      false,
      false,
      true,
      false,
      false,
      true,
      false,
      false,
      false,
      false,
      false,
      true,
      false,
      true,
      false,
      false,
      false,
      false,
      false,
      false,
      false,
      false,
      false,
      false,
      false,
      false,
      false,
      true,
      false,
      false,
      false,
      false,
      false,
      false,
      false,
      false,
      false,
      false,
      false,
      false,
      false,
      false,
      false,
      false,
      false,
      false,
      false,
      false,
      false,
      false,
      true,
      false,
      false,
      false,
      true,
      false,
      false,
      false,
      false,
      false,
      false,
      true,
      false,
      false,
      false,
      false,
      false,
      true,
      false,
      false,
      false,
      false,
      false,
      false,
      false,
      false,
      false,
      false,
      false,
      true,
      false,
      false,
      false,
      true
    ]
  },
  "encounters": [
    {
      "enemy_type": "tank",
      "count": 3,
      "positions": [
        {
          "x": 8,
          "y": 0
        },
        {
          "x": 11,
          "y": 6
        },
        {
          "x": 9,
          "y": 9
        }
      ]
    },
    {
      "enemy_type": "archer",
      "count": 1,
      "positions": [
        {
          "x": 11,
          "y": 2
        }
      ]
    },
    {
      "enemy_type": "grunt",
      "count": 1,
      "positions": [
        {
          "x": 10,
          "y": 7
        }
      ]
    }
  ],
  "player_start": {
    "x": 0,
    "y": 0
  }
}