{
  "id": "room_biome1_01",
  "biome": "biome1",
  "size": {
    "width": 12,
    "height": 12
  },
  "layout": {
    "elevation": [
      0,
      1,
      0,
      0,
      0,
      0,
      1,
      1,
      0,
      0,
      0,
      2,
      2,
      0,
      0,
      0,
      0,
      0,
      2,
      0,
      2,
      1,
      0,
      0,
      2,
      2,
      0,
      0,
      1,
      0,
      2,
      0,
      1,
      1,
      0,
      0,
      0,
      2,
      1,
      2,
      0,
      2,
      0,
      1,
      2,
      0,
      0,
      0,
      0,
      0,
      1,
      0,
      2,
      0,
      0,
      0,
      0,
      0,
      0,
      0,
      1,
      0,
      0,
      0,
      0,
      0,
      0,
      0,
      2,
      0,
      0,
      0,
      1,
      2,
      0,
      2,
      1,
      2,
      1,
      0,
      1,
      0,
      0,
      2,
      1,
      0,
      1,
      2,
      0,
      2,
      0,
      0,
      0,
      0,
      0,
      2,
      0,
      0,
      1,
      2,
      0,
      1,
      1,
      2,
      2,
      0,
      0,
      0,
      1,
      0,
      0,
      1,
      0,
      0,
      0,
      2,
      0,
      0,
      2,
      0,
      0,
      1,
      0,
      0,
      0,
      0,
      1,
      0,
      0,
      0,
      1,
      1,
      0,
      0,
      0,
      1,
      0,
      2,
      2,
      0,
      1,
      1,
      1,
      0
    ],
    "cover": [
      2,
      0,
      1,
      0,
      0,
      2,
      1,
      1,
      0,
      0,
      1,
      1,
      2,
      0,
      2,
      0,
      1,
      0,
      1,
      2,
      1,
      2,
      0,
      2,
      1,
      1,
      0,
      0,
      2,
      0,
      1,
      1,
      0,
      0,
      0,
      1,
      0,
      2,
      1,
      1,
      1,
      0,
      2,
      2,
      0,
      0,
      2,
      2,
      2,
      0,
      1,
      2,
      0,
      0,
      2,
      0,
      2,
      0,
      0,
      1,
      1,
      0,
      2,
      0,
      0,
      0,
      0,
      0,
      0,
      0,
      2,
      0,
      0,
      0,
      2,
      2,
      2,
      1,
      2,
      2,
      0,
      1,
      0,
      0,
      1,
      0,
      0,
      1,
      0,
      2,
      0,
      0,
      0,
      0,
      0,
      1,
      2,
      2,
      2,
      2,
      0,
      0,
      0,
      2,
      0,
      0,
      0,
      2,
      2,
      0,
      0,
      0,
      1,
      2,
      0,
      0,
      2,
      0,
      0,
      0,
      0,
      1,
      2,
      0,
      0,
      0,
      2,
      2,
      0,
      1,
      2,
      0,
      1,
      0,
      2,
      1,
      0,
      1,
      2,
      1,
      1,
      2,
      0,
      2
    ],
    "blocked": [
      false,
      false,
      false,
      false,
      false,
      false,
      false,
      false,
      false,
      false,
      false,
      false,
      false,
      false,
      true,
      false,
      false,
      false,
      false,
      true,
      false,
      false,
      false,
      false,
      false,
      false,
      false,
      false,
      true,
      false,
      false,
      false,
      false,
      false,
      false,
      false,
      false,
      false,
      false,
      false,
      false,
      false,
      true,
      true,
      false,
      false,
      false,
      false,
      true,
      false,
      false,
      true,
      false,
      false,
      true,
      false,
      true,
      false,
      false,
      false,
      false,
      false,
      true,
      false,
      false,
      false,
      false,
      false,
      false,
      false,
      true,
      false,
      false,
      false,
      true,
      false,
      true,
      false,
      false,
      false,
      false,
      false,
      false,
      false,
      false,
      false,
      false,
      false,
      false,
      false,
      false,
      false,
      false,
      false,
      false,
      false,
      true,
      true,
      false,
      false,
      false,
      false,
      false,
      true,
      false,
      false,
      false,
      false,
      true,
      false,
      false,
      false,
      false,
      false,
      false,
      false,
      true,
      false,
      false,
      false,
      false,
      false,
      false,
      false,
      false,
      false,
      true,
      false,
      false,
      false,
      true,
      false,
      false,
      false,
      true,
      false,
      false,
      false,
      false,
      false,
      false,
      true,
      false,
      true
    ],
    "vision_blocked": [
      false,
      false,
      false,
      false,
      false,
      false,
      false,
      false,
      false,
      false,
      false,
      false,
      false,
      false,
      true,
      false,
      false,
      false,
      false,
      true,
      false,
      false,
      false,
      false,
      false,
      false,
      false,
      false,
      true,
      false,
      false,
      false,
      false,
      false,
      false,
      false,
      false,
      false,
      false,
      false,
      false,
      false,
      true,
      true,
      false,
      false,
      false,
      false,
      true,
      false,
      false,
      true,
      false,
      false,
      true,
      false,
      true,
      false,
      false,
      false,
      false,
      false,
      true,
      false,
      false,
      false,
      false,
      false,
      false,
      false,
      true,
      false,
      false,
      false,
      true,
      false,
      true,
      false,
      false,
      false,
      false,
      false,
      false,
      false,
      false,
      false,
      false,
      false,
      false,
      false,
      false,
      false,
      false,
      false,
      false,
      false,
      true,
      true,
      false,
      false,
      false,
      false,
      false,
      true,
      false,
      false,
      false,
      false,
      true,
      false,
      false,
      false,
      false,
      false,
      false,
      false,
      true,
      false,
      false,
      false,
      false,
      false,
      false,
      false,
      false,
      false,
      true,
      false,
      false,
      false,
      true,
      false,
      false,
      false,
      true,
      false,
      false,
      false,
      false,
      false,
      false,
      true,
      false,
      true
    ]
  },
  "encounters": [
    {
      "enemy_type": "archer",
      "count": 1,
      "positions": [
        {
          "x": 10,
          "y": 8
        }
      ]
    }
  ],
  "player_start": {
    "x": 2,
    "y": 9
  }
}